{
  "schema": "film.font-asset-manifest@1",
  "id": "font.fixture-serif-jp",
  "version": "1.0.0",
  "family": "Fixture Serif JP",
  "faces": [
    {
      "file": "FixtureSerifJP-Regular.ttf",
      "weight": 400,
      "style": "normal",
      "stretch": "normal",
      "format": "truetype"
    }
  ],
  "coverage": {
    "scripts": [
      "Latn",
      "Jpan"
    ]
  },
  "fallback": [
    {
      "id": "font.fixture-sans-jp",
      "version": "1.0.0"
    }
  ],
  "source": {
    "origin": "generated by spikes/film/src/fonts/fixture-font.ts",
    "attribution": "film spike fixture"
  },
  "license": {
    "id": "CC0-1.0",
    "file": "LICENSE.txt"
  },
  "rights": {
    "redistribution": true,
    "videoEmbedding": true
  },
  "scope": {
    "kind": "organization"
  }
}
