{
  "schema": "film.font-asset-manifest@1",
  "id": "font.fixture-latin",
  "version": "1.0.0",
  "family": "Fixture Latin",
  "faces": [
    {
      "file": "FixtureLatin-Regular.ttf",
      "weight": 400,
      "style": "normal",
      "stretch": "normal",
      "format": "truetype",
      "sha256": "sha256:84cb65ccd3116c04d92bab796efdcda68d4ce24f9ccfdf8676f8f20e3944e509"
    }
  ],
  "coverage": {
    "scripts": [
      "Latn"
    ],
    "ranges": [
      [
        32,
        126
      ]
    ]
  },
  "fallback": [],
  "source": {
    "origin": "generated by spikes/film/src/fonts/fixture-font.ts",
    "attribution": "film spike"
  },
  "license": {
    "id": "CC0-1.0",
    "file": "LICENSE.txt"
  },
  "rights": {
    "redistribution": true,
    "videoEmbedding": true
  },
  "scope": {
    "kind": "organization"
  }
}
